{
  "$schema": "https://json-schema.org/draft/2020-12/schema",
  "title": "LensTemper Review Ledger",
  "type": "object",
  "required": [
    "schema_version",
    "pass_id",
    "target_path",
    "target_revision",
    "status",
    "run_mode",
    "run_scope",
    "execution_mode",
    "selected_lenses",
    "current_review_record_ids",
    "superseded_review_record_ids",
    "synthesis_record_ids",
    "archive_paths",
    "artifact_visibility",
    "completion_validation",
    "review_record_artifacts",
    "synthesis_record_artifacts"
  ],
  "properties": {
    "schema_version": { "const": 3 },
    "pass_id": { "type": "string" },
    "target_path": { "type": "string" },
    "target_revision": { "type": "string" },
    "review_input_path": { "type": "string" },
    "review_input_revision": { "type": "string" },
    "lens_selection_path": { "type": "string" },
    "lens_selection_revision": { "type": "string" },
    "status": {
      "enum": ["active", "completed", "error", "superseded", "stale"]
    },
    "run_mode": {
      "enum": ["full", "inline", "advisory"]
    },
    "run_scope": {
      "enum": ["core_profile", "selected_lenses"]
    },
    "core_profile_id": { "type": "string", "minLength": 1 },
    "required_lens_ids": {
      "type": "array",
      "items": { "type": "string" },
      "uniqueItems": true
    },
    "completed_lens_ids": {
      "type": "array",
      "items": { "type": "string" },
      "uniqueItems": true,
      "readOnly": true
    },
    "core_gate_passed": { "type": "boolean", "readOnly": true },
    "execution_mode": {
      "enum": ["fresh_spawned_lens_reviewers", "fresh_spawned_orchestrator", "manual_or_imported"]
    },
    "events_path": { "type": "string" },
    "selected_lenses": {
      "type": "array",
      "items": { "type": "string" }
    },
    "current_review_record_ids": {
      "type": "array",
      "items": { "type": "string" }
    },
    "superseded_review_record_ids": {
      "type": "array",
      "items": { "type": "string" }
    },
    "synthesis_record_ids": {
      "type": "array",
      "items": { "type": "string" }
    },
    "archive_paths": {
      "type": "array",
      "items": { "type": "string" },
      "description": "The first entry is the pass's archive: the run directory holding this ledger when create-ledger.mjs wrote it with --out. archive-review-run.mjs archives there."
    },
    "artifact_visibility": {
      "enum": ["public_safe", "private_local_only"]
    },
    "apply_mode": {
      "description": "interactive (default) applies nothing by policy; auto (opt-in) may apply accepted blocking findings that cite a stated goal. Ledgers written before this field keep the policy rule on target_edits only.",
      "enum": ["interactive", "auto"]
    },
    "pass_index": {
      "description": "1 for the first pass of a lineage; absent means 1. Pass 2 is the one automatic rerun; later passes need human_approval.",
      "type": "integer",
      "minimum": 1
    },
    "parent_pass_id": { "type": "string", "minLength": 1 },
    "parent_intent_revision": {
      "description": "Intent card revision of the parent pass. A different current card requires intent.amended_by: human.",
      "type": "string",
      "minLength": 1
    },
    "human_approval": {
      "type": "object",
      "required": ["decided_by", "summary"],
      "properties": {
        "decided_by": { "const": "human" },
        "summary": { "type": "string", "minLength": 1 }
      },
      "additionalProperties": true
    },
    "rerun_decisions": {
      "description": "Written by decide-reruns.mjs --write.",
      "type": "array",
      "items": {
        "type": "object",
        "required": ["lens", "reason"],
        "properties": {
          "lens": { "type": "string" },
          "lens_state": { "enum": ["open", "settled"] },
          "rerun_needed": { "type": "boolean" },
          "reason": { "type": "string" },
          "reviewed_in_pass": { "type": "boolean", "description": "false when the user reopened a lens this pass did not review." }
        },
        "additionalProperties": true
      }
    },
    "completion_validation": {
      "type": "object",
      "readOnly": true,
      "required": [
        "validator_name",
        "validator_contract_version",
        "passed",
        "validated_review_record_ids",
        "failures"
      ],
      "properties": {
        "validator_name": { "type": "string" },
        "validator_contract_version": { "type": "string" },
        "passed": { "type": "boolean" },
        "validated_review_record_ids": {
          "type": "array",
          "items": { "type": "string" }
        },
        "validated_synthesis_record_id": { "type": "string" },
        "failures": {
          "type": "array",
          "items": {
            "type": "object",
            "properties": {
              "claim_type": { "type": "string" },
              "artifact_path": { "type": "string" },
              "field": { "type": "string" },
              "reason": { "type": "string" }
            },
            "additionalProperties": true
          }
        }
      },
      "additionalProperties": true
    },
    "review_record_artifacts": {
      "type": "array",
      "items": {
        "type": "object",
        "required": ["record_id", "artifact_path"],
        "properties": {
          "record_id": { "type": "string" },
          "artifact_path": { "type": "string" },
          "artifact_sha": { "type": "string", "description": "Content hash of the record file, registered by update-ledger.mjs when it attaches the record and by archive-review-run.mjs. A file edited after attachment, or another file reusing the record_id, fails validation." }
        },
        "additionalProperties": true
      }
    },
    "synthesis_record_artifacts": {
      "type": "array",
      "items": {
        "type": "object",
        "required": ["record_id", "artifact_path"],
        "properties": {
          "record_id": { "type": "string" },
          "artifact_path": { "type": "string" },
          "artifact_sha": { "type": "string", "description": "Content hash of the record file, registered by update-ledger.mjs when it attaches the record and by archive-review-run.mjs. A file edited after attachment, or another file reusing the record_id, fails validation." }
        },
        "additionalProperties": true
      }
    },
    "target_edits": {
      "description": "Every edit a host or user makes to the target after this pass's delivery. Each cites a finding id or is logged as host-initiated.",
      "type": "array",
      "items": {
        "type": "object",
        "required": ["decided_by", "summary"],
        "properties": {
          "finding_id": { "type": "string", "minLength": 1 },
          "host_initiated": { "const": true },
          "decided_by": { "enum": ["human", "policy"] },
          "summary": { "type": "string", "minLength": 1 }
        },
        "oneOf": [
          { "required": ["finding_id"] },
          { "required": ["host_initiated"] }
        ],
        "allOf": [
          {
            "if": { "required": ["decided_by"], "properties": { "decided_by": { "const": "policy" } } },
            "then": { "required": ["finding_id"] }
          }
        ],
        "additionalProperties": true
      }
    }
  },
  "additionalProperties": true,
  "allOf": [
    {
      "if": {
        "required": ["pass_index"],
        "properties": { "pass_index": { "minimum": 2 } }
      },
      "then": {
        "required": ["parent_pass_id", "parent_intent_revision"]
      }
    },
    {
      "if": {
        "required": ["pass_index"],
        "properties": { "pass_index": { "minimum": 3 } }
      },
      "then": {
        "required": ["human_approval"]
      }
    },
    {
      "if": {
        "properties": {
          "run_mode": { "const": "full" }
        }
      },
      "then": {
        "required": ["review_input_path", "review_input_revision", "lens_selection_path", "lens_selection_revision"]
      }
    },
    {
      "if": {
        "properties": {
          "run_scope": { "const": "core_profile" }
        }
      },
      "then": {
        "required": ["core_profile_id", "required_lens_ids", "completed_lens_ids", "core_gate_passed"]
      }
    },
    {
      "if": {
        "properties": {
          "execution_mode": { "const": "fresh_spawned_orchestrator" }
        }
      },
      "then": {
        "required": ["events_path"]
      }
    }
  ]
}
