{
  "schema_version": 3,
  "pass_id": "example-detached-pass",
  "target_path": "reviews/examples/artifacts/target.valid.md",
  "target_revision": "git:73eaed921475be235f6684abdd2ce19a4e367c7f",
  "status": "completed",
  "run_mode": "full",
  "run_scope": "selected_lenses",
  "execution_mode": "fresh_spawned_orchestrator",
  "events_path": "reviews/examples/support/events-detached-valid.jsonl",
  "selected_lenses": [
    "implementation"
  ],
  "current_review_record_ids": [
    "review-detached-implementation-1"
  ],
  "superseded_review_record_ids": [],
  "synthesis_record_ids": [
    "synthesis-detached-1"
  ],
  "archive_paths": [
    "reviews/archive/example-detached-pass"
  ],
  "artifact_visibility": "public_safe",
  "completion_validation": {
    "validator_name": "validate-completion-summary",
    "validator_contract_version": "4.1.0",
    "passed": true,
    "validated_review_record_ids": [
      "review-detached-implementation-1"
    ],
    "validated_synthesis_record_id": "synthesis-detached-1",
    "failures": []
  },
  "review_record_artifacts": [
    {
      "record_id": "review-detached-implementation-1",
      "artifact_path": "reviews/examples/review-output.valid-detached.json"
    }
  ],
  "synthesis_record_artifacts": [
    {
      "record_id": "synthesis-detached-1",
      "artifact_path": "reviews/examples/synthesis-output.valid-detached.json"
    }
  ],
  "review_input_revision": "sha256:dc29a2b9712d8555b2b607998bd97d25cc3a61dbc0e447dd8dee1865a6c3833d",
  "review_input_path": "reviews/examples/review-input.valid.json",
  "lens_selection_path": "reviews/examples/lens-selection.valid-detached.json",
  "lens_selection_revision": "git:d771138b06a2ab32d015d67201878f680a743ff6"
}
